username,comment_text,sentiment_score,sentiment_category
真**8,非常不错，和逾期一样。屏幕显示色彩饱和度相对小米11要差点。商家回复：您好，十分感谢您对小米的支持，您可以尝试如下方式对屏幕颜色进行调整，设置-显示与亮度-色彩风格（在勾选“生动”后），在色温盘内调节取点的位置，更改屏幕显示效果的偏好。后续使用中有任何需要帮助的，可以随时联系我们旺旺在线客服。更多,0.05458201542713448,消极
真**8,非常不错，和逾期一样。屏幕显示色彩饱和度相对小米11要差点。,0.7516098006884481,积极
暮**鱼,小屏旗舰的均衡之作，性价比之选    1. 极致手感与颜值   6.36英寸四等边直屏设计，屏占比高达94%，1.38mm超窄边框甚至优于iPhone 16 Pro，握持时轻盈舒适（仅191g），单手操作毫无压力。磨砂玻璃背板与中框设计大幅减少指纹残留，岩石灰配色低调高级，线下体验后直接“种草”。    2. 性能怪兽，游戏党的福音   骁龙8至尊版处理器+24GB LPDDR5X内存组合，安兔兔跑分超272万，实测《原神》高画质60分钟平均帧率59.8，机身温度仅43℃左右，搭配澎湃OS 2.0的系统优化，多任务切换丝滑流畅，彻底告别卡顿。超声波指纹解锁位置合理，识别速度和准确性大幅提升。    3. 徕卡影像，直出即大片   后置5000万像素徕卡三摄（主摄+长焦+超广角）表现惊艳，尤其是夜景模式高光压制和暗部细节远超同价位机型。5X光学变焦和长焦微距功能实用，拍摄演唱会远景或花**写轻松胜任。AI算法优化的人像模式虚化自然，发丝级抠图效果媲美专业相机。    4. 续航与快充双优   5400mAh电池+90W有线快充组合，重度使用一天剩余电量35%，38分钟即可充满。50W无线快充和磁吸配件拓展了充电场景，无线反充功能应急给耳机充电也很实用。    5. 价格真香，国补助力   叠加以旧换新和平台补贴后，12+256GB版本仅需3699元，比首发价直降800元，性价比直接拉满。对比OPPO Find X8s、vivo X200 Pro等同级竞品，配置更均衡，价格优势明显。,1.0,积极
灬**灬,非常好  算得上小屏旗舰  外围配置均衡  得益于新soc的能效提升  续航有明显提升  好用,0.9997099374902713,积极
r**缘,国补买的，加上满减等优惠，三千九百多，使用上暂时没什么，充电的时候发热不怎么明显，就是用久了或者升级系统后会不会拉胯卡顿发热，不要让人失望就好，打算用五六年,0.0007985996565295084,消极
海**1,商品评价:拿到手机的第一感受是机身手感特别棒，对于女生来说单手握非常友好。背面哑光磨砂质感不留指纹兼具美感和高级。紫色的太好看了吧！实体店里看过绿色也好漂亮。苹果老用户了，切换小米竟然没有适应期！！！这个是我很意外的，甚至有些小功能比苹果还要优秀。信号和电池也特别给力，是用苹果从来都没有拥有过的感受（我一整个爆哭），因为不喜欢曲面屏所以选择了小米15，总之，入手小米15的感受就是太棒了！！已被小米圈粉。唯一后悔的地方就是买的晚了没有赠品商家回复：您好，十分感谢您对小米产品的支持。咱们店铺也会不定时推出一些降价、赠品活动，回馈广大客户。但具体活动时间无法确定，还请您多多理解呢。后续您有任何疑问和需求可以联系咱们的旺旺在线客服详细咨询，将竭诚为您服务。更多,0.9999018924095976,积极
海**1,商品评价:拿到手机的第一感受是机身手感特别棒，对于女生来说单手握非常友好。背面哑光磨砂质感不留指纹兼具美感和高级。紫色的太好看了吧！实体店里看过绿色也好漂亮。苹果老用户了，切换小米竟然没有适应期！！！这个是我很意外的，甚至有些小功能比苹果还要优秀。信号和电池也特别给力，是用苹果从来都没有拥有过的感受（我一整个爆哭），因为不喜欢曲面屏所以选择了小米15，总之，入手小米15的感受就是太棒了！！已被小米圈粉。唯一后悔的地方就是买的晚了没有赠品,0.9999999401550217,积极
p**7,国补购买，性价比还可以。 给母亲买，续航优先。 拍照色彩不错，快充有点发烫。商家回复：您好，我们会继续努力，争取给您带来更好的体验。Xiaomi 15采用90W有线充电技术，充电速度快，充电时会伴随有一定的发热现象，属于正常情况。建议您充电时将手机暴露在空气中，减少衣物等织物的接触和包裹，保证良好的散热环境，可有效降低温度。产品使用中有任何需要帮助的，您可以随时联系咱们旺旺在线客服协助处理，我们将竭诚为您服务。更多,0.1769791878762098,消极
p**7,国补购买，性价比还可以。 给母亲买，续航优先。 拍照色彩不错，快充有点发烫。,0.9998553907268023,积极
t**4,很好啊很喜欢 这大小刚刚好商家回复：我们深知，唯有真诚服务，方能赢得您的满意和信任。,0.6451949351500789,积极
t**4,很好啊很喜欢 这大小刚刚好,0.9784254628193091,积极
风**2,第一次在官方旗舰店购买，享受国补加平台券很优惠。发货很快的，次日达，就是手机电池不耐用商家回复：您好，非常抱歉给您带来不便了，手机在长时间运行大型游戏、看超清视频时，多核会同时运行，手机功耗会增大，故耗电快属正常现象。您也可以在使用手机的时候查看一下后台是否运行了大量第三方软件，若同时运行过多软件容易增加电量功耗，可以定期清理手机后台应用程序，关闭不使用的功能；同时您也可以开启电池省电模式配合使用。后续我们也会不断针对系统续航以及其他方面进行优化。产品后期使用中如有疑问，您可以联系咱们旺旺在线客服详细咨询，竭诚为您服务。更多,0.9446146623522156,积极
风**2,第一次在官方旗舰店购买，享受国补加平台券很优惠。发货很快的，次日达，就是手机电池不耐用,0.8738808764988881,积极
槿**啊,买之前看了很多网上的评价，有很多不好的地方，但还是比较喜欢就买了，所以这种东西还是得自己用了才知道，网上说的那些没有一样遇到过，手机质感很好，很小巧，各方面都挺好的，最喜欢的就是实况😉再多用一段时间看看，还是蛮相信雷军的商家回复：我们深知，唯有真诚服务，方能赢得您的满意和信任。,0.9980709357455657,积极
槿**啊,买之前看了很多网上的评价，有很多不好的地方，但还是比较喜欢就买了，所以这种东西还是得自己用了才知道，网上说的那些没有一样遇到过，手机质感很好，很小巧，各方面都挺好的，最喜欢的就是实况😉再多用一段时间看看，还是蛮相信雷军的,0.9999225062801139,积极
想**是,用小米品牌很多年了，一直觉得整体还不错，挺智能的商家回复：喜欢看您的评价，处处繁花似锦；喜欢等您的到来，处处满面春风~,0.9992011737796173,积极
想**是,用小米品牌很多年了，一直觉得整体还不错，挺智能的,0.9990464988825982,积极
y**i,不错，操作，丝滑 拍摄图片清晰商家回复：我们深知，唯有真诚服务，方能赢得您的满意和信任。,0.8722636576152794,积极
y**i,不错，操作，丝滑 拍摄图片清晰,0.9941623388106944,积极
t**3,国补手机，当天买第二天到，跟平时买的差不多，就是要当面签收拍照，没什么区别。还好吧，手机非常完美，非常beautiful，没什么问题，支持商家回复：精美的包装，贴心的服务，物流高效，我们这么努力，只是为了得到您的爱，陪伴您朝朝与暮暮~,0.4450574749274643,中性
t**3,国补手机，当天买第二天到，跟平时买的差不多，就是要当面签收拍照，没什么区别。还好吧，手机非常完美，非常beautiful，没什么问题，支持,0.04585959909557635,消极
j**葆,手机是不错，就是贴钢化膜需要用力按压才能解锁，用得绿联。,0.824033377562173,积极
t**0,此用户没有填写评价。5天后追评：小米15的拍照功能表现出色，尤其在人物、静物和建筑物拍摄中均有亮眼表现。   -人物：人像模式背景虚化自然，肤色还原真实，细节保留丰富，逆光环境下HDR效果显著，无明显噪点。   静物：微距拍摄色彩鲜艳，层次感强，对焦迅速，适合美食或小物件特写，画面通透度高。   建筑物：广角镜头畸变控制优秀，线条平直，暗部细节清晰，夜景模式降噪能力强，光影层次分明。商家回复：记录生活、记录您，小米～您身边的拍照专家。,0.9999999999982798,积极
t**0,此用户没有填写评价。,0.14542800010477508,消极
t**0,5天后追评：小米15的拍照功能表现出色，尤其在人物、静物和建筑物拍摄中均有亮眼表现。   -人物：人像模式背景虚化自然，肤色还原真实，细节保留丰富，逆光环境下HDR效果显著，无明显噪点。   静物：微距拍摄色彩鲜艳，层次感强，对焦迅速，适合美食或小物件特写，画面通透度高。   建筑物：广角镜头畸变控制优秀，线条平直，暗部细节清晰，夜景模式降噪能力强，光影层次分明。,0.999999999997961,积极
m**z,国补价格很香，发的顺丰第二天就到了，这个绿色我在线下看过挺好看的淡淡的。目前用着挺丝滑的。唯一不太习惯就是拍照有点色差，颜色偏暗，另一个模式饱和度又太高。商家回复：您好，非常抱歉给您带来了不好的体验。手机内置的相机会根据环境光进行色彩平衡和调节，不同角度下光线环境也较为复杂，部分特定角度或者环境下可能会与实际色彩有一定偏差，这个是正常情况，建议您适当调整拍摄角度，或者尝试在不同的光线环境下拍摄查看下呢。后续您有任何疑问和需求可以联系咱们的旺旺在线客服详细咨询，将竭诚为您服务。更多,0.012383372395483372,消极
m**z,国补价格很香，发的顺丰第二天就到了，这个绿色我在线下看过挺好看的淡淡的。目前用着挺丝滑的。唯一不太习惯就是拍照有点色差，颜色偏暗，另一个模式饱和度又太高。,0.07878051582403878,消极
恶**迹,通信音质：一般 拍照很好，屏幕色彩也很好。手机续航还可以。就是手机系统有点拉胯，经常卡屏死机，需要重启手机才行。商家回复：您好，非常抱歉给您带来不便。音质差建议您：检查手机所处位置是否为信号较弱区域，尽量在开阔地带使用；有效备份数据更新系统尝试，更换sim卡尝试。手机若出现突然死机的现象，建议您：使用某软件时死机，先等待一段时间，一般会出现“xxx程序未响应，是否关闭”，可以点击关闭后重新打开该软件使用；如果手机卡住很久没有反应，先尝试点击HOME键（若使用全面屏手势操作，可尝试上滑退出），看是否可返回桌面，或点击任务键调出任务管理将卡死的程序关闭，重新打开使用；如果手机无任何反应，长按电源键10秒以上进行强制重启。另外，建议您将软件版本升级至最新再进行使用。方法：打开【应用商店】，点击【我的】，点击【一键升级】。产品后期使用中如有疑问，您可以访问咱们旺旺在线客服详细咨询，竭诚为您服务。更多,1.1903500407584033e-10,消极
恶**迹,通信音质：一般 拍照很好，屏幕色彩也很好。手机续航还可以。就是手机系统有点拉胯，经常卡屏死机，需要重启手机才行。,0.8727877926177497,积极
鲸**o,手机蛮好的，反应迅速，外形简洁美观，重量也适中，就是插卡时的puk码难倒了我。一直用的都是小米家的手机，上个小米11青春版用了三年零十个月，平价还亲民，期待后续试用效果。物流也超快的，晚上九点二十九分下单，上午九点四十左右就收到了，点个大大的赞！,0.9999998597781471,积极
t**9,运行流畅，外观精致，稍微有点发热，系统操作方便，拍照好，屏幕清晰💖你商家回复：您好，非常的抱歉给您带来了不便。在一些高功耗的场景下，如玩手机游戏、播放高清视频、连续摄像、升级手机系统时，机身会发热，这是手机散热功能正常的表现，当停止这些高功耗应用后，手机机身温度能快速恢复正常。建议及时关闭不使用的后台软件，并尽量避免边充电边使用手机，以降低发热量哦。产品使用中您有任何需要和疑问都可以联系咱们旺旺在线客服详细咨询，将竭诚为您服务。更多,0.7920630593290278,积极
t**9,运行流畅，外观精致，稍微有点发热，系统操作方便，拍照好，屏幕清晰💖你,0.9992742392428858,积极
ご**丶,What can Isay，小米就是国内顶级(๑>؂<๑）(๑>؂<๑）(๑>؂<๑）(๑>؂<๑）(๑>؂<๑）(๑>؂<๑）(๑>؂<๑）,0.9910479331116857,积极
q**6,小米手机以其出色的性价比和稳定的性能赢得了消费者的广泛好评。在使用过程中，小米手机的流畅度和操作体验给我留下了深刻印象。同时，其丰富的功能配置和良好的售后服务也是其优点之一。总的来说，小米手机是一款值得推荐的智能手机产品。商家回复：产品的出色不止是性价比，超高的服务，超强的性能，供您日后体验。,0.9999999999612617,积极
q**6,小米手机以其出色的性价比和稳定的性能赢得了消费者的广泛好评。在使用过程中，小米手机的流畅度和操作体验给我留下了深刻印象。同时，其丰富的功能配置和良好的售后服务也是其优点之一。总的来说，小米手机是一款值得推荐的智能手机产品。,0.9999999986272683,积极
暮**鱼,全部评价,0.4279835390946498,中性
想**是,商家回复：喜欢看您的评价，处处繁花似锦；喜欢等您的到来，处处满面春风~,0.5700804878157637,中性
